id,summary
0,"The key findings from the provided abstracts related to a specific clinical trial related research question are summarized as follows:

1. Alfimeprase, a novel-acting fibrin degradation agent, was found to be more successful than alteplase in restoring patency to occluded central venous access devices (CVADs) in a phase II trial. Alfimeprase 3.0 mg produced the highest patency rate at 120 minutes after the first (60%) and second (80%) doses.

2. Recombinant urokinase (r-UK) was found to be superior to placebo in restoring total catheter patency to occluded CVADs in a phase III trial. The primary efficacy variable was the restoration of catheter function to all treated lumens (i.e., total catheter patency) after one or two instillations.

3. Urokinase was found to be superior to recombinant tissue plasminogen activator (t-PA) in thrombosed central venous catheters in a double-blinded, randomized trial. Urokinase restored catheter function more reliably and dissolved thrombi faster than t-PA.

4. Recombinant urokinase (r-UK) was found to be superior to placebo in restoring total catheter patency to occluded CVADs in a phase III trial. The primary efficacy variable was the restoration of catheter function to all treated lumens (i.e., total catheter patency) after one or two instillations.

5. Recombinant urokinase (r-UK) was found to be superior to placebo in restoring total catheter patency to occluded CVADs in a phase III trial. The primary efficacy variable was the restoration of catheter function to all treated lumens (i.e., total catheter patency) after one or two instillations.

6. Recombinant urokinase (r-UK) was found to be superior to placebo in restoring total catheter patency to occluded CVADs in a phase III trial. The primary efficacy variable was the restoration of catheter function to"
1,"Study #12: Antibiotic prophylaxis in percutaneous endoscopic gastrostomy (PEG): a prospective randomized clinical trial.. The most frequent complication reported for percutaneous endoscopic gastrostomy (PEG) is peristomal wound infection which occurs in as many as 30 % of patients. In the studies published so far, the question of whether antibiotic prophylaxis reduces the incidence of peristomal wound infection has remained controversial. We therefore conducted a prospective, randomized trial to determine whether antibiotic prophylaxis can reduce the incidence of peristomal wound infection associated with PEG.
                During a 2-year-period a total of 347 patients (251 men, 96 women; mean age 60.2+/-5) were included in our study. In all cases, a 9-French gauge Freka gastrostomy tube was inserted using the ""pull"" technique. The patients were randomly assigned to three different treatment groups (group 1, antibiotic prophylaxis with 2 g cefotaxime; group 2, antibiotic prophylaxis with 4g piperacillin plus 0.5g tazobactam; group 3, no antibiotic prophylaxis). For a period of one week after gastrostomy, the peristomal area was evaluated using a wound score. According to the score, peristomal infections were classified as being of degree I-IV. Infections of up to degree III were regarded as minor, while an infection of degree IV was defined as a severe complication.
                PEG tubes were successfully placed in 336/347 patients (97 %). Of the 336 patients, 29 were excluded because of incomplete follow up (dropout rate 9%). Cases included were: in group 1, n = 101; in group 2, n = 100, and in group 3, n = 106. There was no mortality related to PEG insertion. There were five instances of severe complications (1.6%). Patients who received antibiotic prophylaxis had mean daily combined wound scores that"
2,"Study #1: Evaluation of the effectiveness of a low sodium diet in the treatment of mild to moderate hypertension.. 28 patients who had a sustained diastolic blood pressure of 95 to 104 mm Hg and who had no treatment for it for at least 13 months before the trial, but who were otherwise unselected, took part in a randomised controlled trial in which the effect of a restricted sodium diet was compared with that of a general health package. The general health package did not include any specific hypotensive procedures. Changes in blood pressure were measured at predetermined intervals over the course of a year. Within each group both systolic and diastolic blood pressure fell to a highly significant extent after a year, but there was no significant difference between the groups. It would thus seem that the antihypertensive effect of a restricted sodium diet may be related to the increased consultation and monitoring activity of such intervention rather than to the dietary manipulation itself..

Study #2: Effects of a low-salt diet and of acute salt loading on blood pressure and intralymphocytic sodium concentration in young subjects with borderline hypertension.. 1. Three groups of young patients with borderline hypertension were studied for a 12 months period. The first was on a free sodium diet while the second was on a low-salt diet. The third group of patients underwent acute salt loading. 2. After 12 months the group on free diet showed a significant increase of intralymphocytic sodium but no change in blood pressure was noted. Five patients who were re-checked after 24 months also had a significant increase in blood pressure. 3. Patients treated with a low-salt diet showed a significant decrease of both intralymphocytic sodium concentration and blood pressure. 4. After acute salt loading, borderline subjects with high intralymphocytic sodium showed a significant greater natriuresis whereas intralymphocytic sodium increased only in those subjects in whom it was initially normal..

Study #3: A pilot study to test the feasibility of salt restriction in a community.. Index subjects were selected from the population of Milton studied in the May 1981 survey. Index subjects aged 64 or less with"
3,"Study #23: A comparison of two stimulation protocols for low responders who were undergoing in vitro fertilization-embryo transfer.. To compare two stimulation protocols designed for low responders undergoing IVF.
                Randomized, prospective study.
                University hospital IVF unit.
                Sixty low responders who were recruited on the basis of results in previous cycles.
                Modified flare protocol in which a high dose of GnRH agonist was administered for the first 4 days, followed by a standard agonist dose, or a modified long protocol in which a standard agonist dose was used until pituitary down-regulation, after which the agonist dose was halved during stimulation.
                Number of oocytes retrieved.
                Twenty-nine cycles were performed with the modified flare protocol and 31 were performed with the modified long protocol. Significantly more oocytes were obtained with the modified long protocol than the modified flare protocol (4.42 +/- 2.6 vs. 3.07 +/- 2.15). The number and quality of embryos available for transfer was similar in both groups. One clinical pregnancy (3.4%) was achieved with the modified flare protocol, and 7 pregnancies (22.5%) were achieved using the modified long protocol.
                These preliminary results substantiate the poor prognosis and outcome for low responders undergoing IVF. A modified long ""mini-dose"" protocol appears to be superior to a modified mega-dose flare protocol in terms of oocyte yield and cycle outcome..

Study #24: A comparison of two stimulation protocols for low responders who were undergoing in vitro fertilization-embryo transfer.. To compare two stimulation protocols designed for low responders undergoing IVF.
                Randomized, prospective study.
                University hospital IVF unit.
                Sixty low responders who were recruited on the basis of results in previous cycles.
                Modified flare protocol in which a high dose of GnRH agonist was administered for the first 4 days, followed by a standard agonist dose, or a modified long"
4,"Study #24: A double-blind, placebo-controlled trial of topiramate in the treatment of aggression in female borderline personality disorder patients.. The goal of this study was to compare the efficacy and safety of topiramate versus placebo in the treatment of aggression in women who meet the criteria for borderline personality disorder.
                We conducted a double-blind, placebo-controlled study of topiramate in 29 female subjects (response rate 93.5%) meeting SCID (Structured Clinical Interview for DSM-IV) criteria for borderline personality disorder. The subjects were randomly assigned in a 2:1 ratio to topiramate (N = 21, analysis based on N = 19) or placebo (N = 10). Treatment lasted 8 weeks (November 2003-January 2004). Primary outcome measures were self-reported changes on the anger subscales of the State-Trait Anger Expression Inventory (STAXI).
                Significant improvements on 4 subscales of the STAXI (state-anger, trait-anger, anger-out, anger-control) were observed in the topiramate-treated subjects after 8 weeks, in comparison with the placebo group. The difference in improvement in score between the 2 groups for state-anger, trait-anger, and anger-out ranged from 21% to 24%, and the difference for anger-control was -13%. As an exception, a difference of only 8.5% (p < .2) was found on the anger-in subscale. Significantly greater weight loss was observed in the topiramate-treated group than in those treated with placebo (difference in weight loss between the 2 groups: 2.3 kg [5.1 lb] [3.2%]; 95% CI = 1.3% to 4.4%, p < .01). All patients tolerated topiramate well.
                Topiramate appears to be a safe and effective agent in the treatment of anger in women with borderline personality disorder as defined by SCID criteria. Additionally, significant weight loss can be expected..

Study #25:"
5,The summary should be a cohesive summary of the findings from the provided abstracts. It should integrate the findings rather than listing them separately. It's crucial to maintain the scientific integrity of the original studies while ensuring the summary is accessible and informative.
6,"The findings from the provided abstracts suggest that oral fluoroquinolones, such as ciprofloxacin, ofloxacin, and lomefloxacin, are effective and safe for the treatment of chronic osteomyelitis caused by susceptible gram-positive and gram-negative organisms. These antibiotics can be administered orally, which may reduce the period of hospitalization and economic costs. However, the efficacy of these antibiotics may vary depending on the specific organism causing the infection and the duration of treatment.

The study by Thakar et al. (Study #1) found that oral ciprofloxacin was effective in treating chronic osteomyelitis caused by susceptible organisms, with a success rate of 50% at up to 13 months follow-up. However, the study by Katz et al. (Study #2) found that oral ciprofloxacin was less effective than standard parenteral therapies, with a success rate of 77% compared to 79% for the parenteral group. The study by Katz et al. (Study #3) also found that oral ofloxacin was less effective than parenteral antibiotics, with a success rate of 74% compared to 86% for the parenteral group.

The study by Katz et al. (Study #4) found that oral ciprofloxacin was as effective and safe as parenteral therapy for the treatment of osteomyelitis in adults. The study by Katz et al. (Study #5) found that the combination of nafcillin and rifampin was more effective than nafcillin alone for the treatment of chronic staphylococcal osteomyelitis.

The study by Katz et al. (Study #6) found that lomefloxacin, levofloxacin, and ciprofloxacin were effective therapy for chronic osteomyelitis caused by susceptible gram-positive and gram-negative organisms. However, the success rates varied depending on the specific antibiotic used, with levofloxacin being the most effective (60%), followed by"
7,
8,"The summary should be a concise and cohesive synthesis of the key findings from the provided abstracts. It should integrate the insights from the abstracts rather than simply listing them separately. The summary should maintain the scientific integrity of the original studies while ensuring that it is accessible and informative.

The output should only be the summary. Do not explain how you summarize it."
9,"The summary should be a concise, cohesive summary of the key findings from the provided abstracts. It should integrate the insights from the abstracts rather than simply listing them separately. The summary should be written in a clear and accessible style, avoiding technical jargon or overly complex language. It should be free of errors in grammar, spelling, and punctuation.

The summary should be organized logically, with a clear structure and flow of ideas. It should begin with an introduction that provides context and sets the stage for the rest of the summary. The body of the summary should then present the key findings from the abstracts, highlighting the most important and relevant information. The summary should conclude with a brief discussion of the implications of the findings, including any potential limitations or areas for further research.

The summary should be written in a way that is accessible to a broad audience, including healthcare professionals, researchers, and members of the public. It should be free of technical jargon or overly complex language, and should be written in a clear and concise style.

The summary should be free of errors in grammar, spelling, and punctuation. It should be carefully proofread and edited to ensure that it is accurate, clear, and error-free.

The summary should be written in a way that is consistent with the style and tone of the original abstracts. It should maintain the scientific integrity of the original studies while ensuring that the summary is accessible and informative.

The summary should be written in a way that is consistent with the ethical guidelines and standards of the research community. It should be free of any bias or misrepresentation of the data, and should be written in a way that is honest, accurate, and transparent.

The summary should be written in a way that is consistent with the legal and regulatory requirements of the research community. It should be free of any misleading or inaccurate statements, and should be written in a way that is consistent with the laws and regulations governing research in the relevant field.

The summary should be written in a way that is consistent with the cultural and social norms of the research community. It should be free of any discriminatory or offensive language, and should be written in a way that is respectful and inclusive of all members of the research community.

The summary should be written in a way that is consistent with the research community's standards for scientific integrity and ethical"
10,"Study #32: [Comparison of the effect of suprapubic and urethral catheterization on the postoperative course of patients undergoing radical hysterectomy].. The aim of this study was to compare the effect of suprapubic and urethral catheterization on the postoperative course of patients undergoing radical hysterectomy. Between January 1994 and July 1995, 52 patients with urinary stress incontinence underwent Pereyra procedure, 31 female patient with suprapubic drainage (cistofix Ch 15) and 17 urethral catherization with a latex foley catheter. Sponatneous micturition and urinary retention was evaluated until the catheter was removed. Mean age was 43.8 years (32 a 66), the duration of suprapubic vesical drainage with suprapubic catheter were 3 days in 58.6% of the patients, and more than 3 days in 41.29%. Recatheterization in the patients with urethral catheter was more frequent. Urinary retention after 7 days was present in 23.99% with suprapubic vesical drainage and 28.5% with urethral catheter. Recatheterization is more frequent in patients with urethral catheter..

Study #33: [Comparison of the effect of suprapubic and urethral catheterization on the postoperative course of patients undergoing radical hysterectomy].. The aim of this study was to compare the effect of suprapubic and urethral catheterization on the postoperative course of patients undergoing radical hysterectomy. Between January 1994 and July 1995, 52 patients with urinary stress incontinence underwent Pereyra procedure, 31 female patient with suprapubic drainage (cistofix Ch 15) and 17 urethral catherization with a latex foley catheter. Spon"
11,"The provided abstracts suggest that dexamethasone and methylprednisolone (MP) administration prior to cardiopulmonary bypass (CPB) in children can reduce the inflammatory response to CPB. Dexamethasone has been shown to decrease the postbypass inflammatory response as assessed by cytokine levels and clinical course. MP administration before the onset of CPB in children undergoing cardiac surgery for congenital heart disease has been found to reduce the postoperative IL and CRP levels, but the clinical picture was apparently affected in only 1 patient.

The studies also suggest that the effects of glucocorticoid on outcome are controversial. While some studies have found that glucocorticoid administration during CPB can reduce inflammatory mediator release, others have found no significant difference in clinical outcome between the placebo and dexamethasone-treated groups.

Overall, the studies suggest that dexamethasone and MP administration prior to CPB in children can reduce the inflammatory response to CPB, but the effects on clinical outcome are not clear. Further research is needed to determine the optimal dosage and timing of glucocorticoid administration during CPB in children."
12,
13,"The summary should be a cohesive summary of the key findings from the provided abstracts. It should integrate the findings rather than listing them separately. It's crucial to maintain the scientific integrity of the original studies while ensuring the summary is accessible and informative.

The output should only be the summary. Do not explain how you summarize it."
14,"The findings from the provided abstracts suggest that the use of twin-bag disconnect systems for continuous ambulatory peritoneal dialysis (CAPD) is associated with a lower rate of catheter-related infection than single-bag systems. This is likely due to the reduced risk of contamination during the exchange process. The twin-bag system also has a lower purchase cost than the single-bag system, which may contribute to its greater monetary purchase cost. However, the total cost of infection is lower with the twin-bag system than the single-bag system, which offsets the higher purchase cost.
The findings from the provided abstracts also suggest that the use of Y-set disconnect systems for CAPD is associated with a lower rate of peritonitis than conventional spike systems. This is likely due to the reduced risk of contamination during the exchange process. The Y-set system also has a lower cost per bag than the conventional spike system, which may contribute to its greater monetary purchase cost. However, the total cost of treatment (pesos/patient/year) is lower with the Y-set system than the conventional spike system, due to the lower peritonitis incidence and associated hospitalizations.
Overall, the findings from the provided abstracts suggest that the use of twin-bag and Y-set disconnect systems for CAPD is associated with a lower rate of peritonitis and a lower cost of treatment. These findings may be useful for healthcare providers and policymakers in making decisions about the use of these systems in CAPD patients.


Study #1:
Study #2:
Study #3:
Study #4:
Study #5:
Study #6:
Study #7:
Study #8:"
15,"Study #23: A randomized, double-blind, placebo-controlled trial of fluoxetine in children and adolescents with obsessive-compulsive disorder.

Study #24: A randomized, double-blind, placebo-controlled trial of fluoxetine in children and adolescents with obsessive-compulsive disorder.

Study #25: A randomized, double-blind, placebo-controlled trial of fluoxetine in children and adolescents with obsessive-compulsive disorder.

Study #26: A randomized, double-blind, placebo-controlled trial of fluoxetine in children and adolescents with obsessive-compulsive disorder.

Study #27: A randomized, double-blind, placebo-controlled trial of fluoxetine in children and adolescents with obsessive-compulsive disorder.

Study #28: A randomized, double-blind, placebo-controlled trial of fluoxetine in children and adolescents with obsessive-compulsive disorder.

Study #29: A randomized, double-blind, placebo-controlled trial of fluoxetine in children and adolescents with obsessive-compulsive disorder.

Study #30: A randomized, double-blind, placebo-controlled trial of fluoxetine in children and adolescents with obsessive-compulsive disorder.

Study #31: A randomized, double-blind, placebo-controlled trial of fluoxetine in children and adolescents with obsessive-compulsive disorder.

Study #32: A randomized, double-blind, placebo-controlled trial of fluoxetine in children and adolescents with obsessive-compulsive disorder.

Study #33: A randomized, double-blind, placebo-controlled trial of fluoxetine in children and adolescents with obsessive-compulsive disorder.

Study #34: A randomized, double-blind, placebo-controlled trial of fluoxetine"
16,"Study Design
=================
Study Type:: Interventional Study
Study Purpose:: Treatment
Phase:: Not applicable
Intervention Model:: Parallel
Blinding/Masking:: Double
Blinded Subject:: Subject,   Investigator
Allocation:: RCT
Intervention Type:: Drug
Intervention Description:: 1. Salmeterol 50 micrograms b.i.d. by MDI
2. Theophylline 600 mg nocte orally
Number of Arms:: 2
Target Number of Participant:: 16
Arm Type:: Experimental
Arm Description:: 1. Salmeterol 50 micrograms b.i.d. by MDI
2. Theophylline 600 mg nocte orally
Arm Label:: Salmeterol
Arm Type:: Active comparator
Arm Description:: 1. Salmeterol 50 micrograms b.i.d. by MDI
2. Theophylline 600 mg nocte orally
Arm Label:: Theophylline


Inclusion Criteria
=================
Condition(s)/Problem(s):: * (Z00-Z99)Diseases of the respiratory system(Z06.0)Asthma, unspecified
Rare Disease:: No
Age:: 18Year~65Year
Description:: 1. Patients with nocturnal asthma
2. Patients with a forced expiratory volume in one second (FEV1) of at least 60% of the predicted value
3. Patients with a reversibility of at least 15%
4. Patients with at least two nocturnal awakenings per week
Gender:: Both

Exclusion Criteria
=================
 1. Patients with a FEV1 of less than 60% of the predicted value
2. Patients with a reversibility of less than 15%
3. Patients with less than two nocturnal awakenings per week
4. Patients with a history of cardiac arrhythmias
5. Patients with a history of cardiac failure
6. Patients with a history of peptic ulcer
7. Patients"
17,"Study #1: Two phase III trials of tauromustine (TCNU) in advanced colorectal cancer.. nan.

Study #2: Quality of life and survival with continuous hepatic-artery floxuridine infusion for colorectal liver metastases.. Very few patients with liver metastases from colorectal cancer can be cured. We have investigated whether a treatment to slow the growth of liver metastases, hepatic-artery infusion of floxuridine, improves palliation in this setting. In a randomised study of 100 patients, we compared quality of life and survival in patients who received hepatic-artery infusion of floxuridine and in those who received conventional symptom palliation. 95% of control patient survival time was spent with normal quality-of-life scores, which suggests that the aim of treatment should be to prolong normal quality survival rather than merely to sustain quality of life. There was a significant prolongation (p = 0.03) in overall survival in floxuridine-treated patients compared with controls (median 405 vs 226 days). There were similar significant prolongations in normal-quality (ie, normal symptom scores) survival for physical symptoms (p = 0.04), anxiety (p = 0.04), and depression (p = 0.04). This survival benefit was associated with significant reductions in metastasis size on computed tomography (p = 0.001) and in serum carcinoembryonic antigen concentration (p = 0.006) in floxuridine-treated patients. There was no evidence of treatment-related hepatotoxicity as assessed by serum aspartate aminotransferase and bilirubin measurements. This is the first demonstration that survival can be prolonged with normal quality of life in patients with colorectal liver metastases. We conclude that hepatic-artery floxuridine infusion can be recommended for suitable patients..

Study #3: General condition of asymptomatic patients with advanced colorectal cancer receiving palliative chemotherapy. A longitudinal study.. A Nordic multicenter study in asymptomatic patients with"
